<?xml version="1.0" encoding="UTF-8"?>
<family xmlns:xsi="http://www.w3.org/2001/XMLSchema-instance" xsi:noNamespaceSchemaLocation="../family.xsd">
	<metadata>
		<name>idNameFamily</name>
		<description>idDescriptionFamily</description>
		<author>idAuthor</author>
		<languagesPath>assets/Locale/eAdventure</languagesPath>
		<iconPath>assets/Interface/Icons/eAdventure/IconoeAdventure.png</iconPath>
	</metadata>
	<stages>
		<scaleStage stageLabel="idMultiStageLabel1" idPanel="ScalePanel">
			<iconPath>assets/Interface/Icons/eAdventure/IconosBarraSuperior_0000_Complexion.png</iconPath>
			<boneController controllerLabel="idBoneControler1" idController="torsoHeadArms" level="0"/>
			<boneController controllerLabel="idBoneControler2" idController="head" level="1"/>
			<boneController controllerLabel="idBoneControler3" idController="arms" level="1"/>
			<boneController controllerLabel="idBoneControler4" idController="leftArm" level="2"/>
			<boneController controllerLabel="idBoneControler5" idController="leftHand" level="3"/>
			<boneController controllerLabel="idBoneControler6" idController="rightArm" level="2"/>
			<boneController controllerLabel="idBoneControler7" idController="rightHand" level="3"/>
			<boneController controllerLabel="idBoneControler8" idController="legs" level="0"/>
			<boneController controllerLabel="idBoneControler9" idController="leftLeg" level="1"/>
			<boneController controllerLabel="idBoneControler10" idController="leftFoot" level="2"/>
			<boneController controllerLabel="idBoneControler11" idController="rightLeg" level="1"/>		
			<boneController controllerLabel="idBoneControler12" idController="rightFoot" level="2"/>			
		</scaleStage>
		<multiStage stageLabel="idMultiStageLabel2">
			<iconPath>assets/Interface/Icons/eAdventure/IconosBarraSuperior_0001_Piel.png</iconPath>
			<subStage subStageType="textureSubStage" subStageLabel="idTextureSubStageLabel1" idPanel="skinsPanel" multiselection="false"/>
		</multiStage>
		<multiStage stageLabel="idMultiStageLabel3">
			<iconPath>assets/Interface/Icons/eAdventure/IconosBarraSuperior_0002_Ojos.png</iconPath>
			<subStage subStageType="textureSubStage" subStageLabel="idTextureSubStageLabel2" idPanel="eyesPanel" multiselection="true"/>
			<subStage subStageType="textureSubStage" subStageLabel="idTextureSubStageLabel3" idPanel="eyebrowsPanel" multiselection="true"/>
		</multiStage>
		<multiStage stageLabel="idMultiStageLabel4">
			<iconPath>assets/Interface/Icons/eAdventure/IconosBarraSuperior_0003_Camiseta.png</iconPath>
			<subStage subStageType="textureSubStage" subStageLabel="idTextureSubStageLabel4" idPanel="tshirtsPanel" multiselection="false"/>
		</multiStage>
		<multiStage stageLabel="idMultiStageLabel5">
			<iconPath>assets/Interface/Icons/eAdventure/IconosBarraSuperior_0004_Pantalones.png</iconPath>
			<subStage subStageType="textureSubStage" subStageLabel="idTextureSubStageLabel5" idPanel="trousersPanel" multiselection="false"/>
		</multiStage>		
		<multiStage stageLabel="idMultiStageLabel6">
			<iconPath>assets/Interface/Icons/eAdventure/IconosBarraSuperior_0005_Calzado.png</iconPath>
			<subStage subStageType="textureSubStage" subStageLabel="idTextureSubStageLabel6" idPanel="shoesPanel" multiselection="false"/>
			<subStage subStageType="textureSubStage" subStageLabel="idTextureSubStageLabel7" idPanel="socksPanel" multiselection="true"/>
		</multiStage>
		<multiStage stageLabel="idMultiStageLabel7">
			<iconPath>assets/Interface/Icons/eAdventure/IconosBarraSuperior_0006_Pelo.png</iconPath>
			<subStage subStageType="meshSubStage" subStageLabel="idTextureSubStageLabel8" idPanel="hairsPanel" multiselection="false"/>
		</multiStage>
		<multiStage stageLabel="idMultiStageLabel8">
			<iconPath>assets/Interface/Icons/eAdventure/IconosBarraSuperior_0007_Accesorios.png</iconPath>
			<subStage subStageType="textureSubStage" subStageLabel="idTextureSubStageLabel9" idPanel="facePanel" multiselection="true"/>
			<subStage subStageType="textureSubStage" subStageLabel="idTextureSubStageLabel10" idPanel="accesoriesFacePanel" multiselection="true"/>
			<subStage subStageType="textureSubStage" subStageLabel="idTextureSubStageLabel11" idPanel="otherAccesoriesPanel" multiselection="true"/>
		</multiStage>
		<animationStage stageLabel="idAnimationStageLabel1">
			<!-- Dar valores. Los que hay son aleatorios -->
			<fps qualityLabel="idQualityLabel1" fpsValue="24"/>
			<fps qualityLabel="idQualityLabel2" fpsValue="12"/>
			<fps qualityLabel="idQualityLabel3" fpsValue="6"/>
			<camera cameraLabel="idCameraLabel1">
				<upAxis valueX="0.0" valueY="1.0" valueZ="0.0"/>
				<location valueX="0.0" valueY="0.0" valueZ="10.0"/>
				<direction valueX="0.0" valueY="0.0" valueZ="-1.0"/>
			</camera>
			<camera cameraLabel="idCameraLabel2">
				<upAxis valueX="0.0" valueY="1.0" valueZ="0.0"/>
				<location valueX="-3.0" valueY="5.0" valueZ="10.0"/>
				<direction valueX="0.0" valueY="0.0" valueZ="-1.0"/>
			</camera>
		</animationStage>
	</stages>
	<modelsRef>
		<modelRef>
			<modelLabel>idModelLabel1</modelLabel>
			<iconPath>assets/Interface/Icons/eAdventure/eAdventure-chico.png</iconPath>
			<modelPath>assets/XML Configuration/models/eAdventure/Man.xml</modelPath>
		</modelRef>
		<modelRef>
			<modelLabel>idModelLabel2</modelLabel>
			<iconPath>assets/Interface/Icons/eAdventure/eAdventure-chica.png</iconPath>
			<modelPath>assets/XML Configuration/models/eAdventure/Woman.xml</modelPath>
		</modelRef>	
		<modelRef>
			<modelLabel>idModelLabel3</modelLabel>
			<iconPath>assets/Interface/Icons/eAdventure/young_boy.png</iconPath>
			<modelPath>assets/XML Configuration/models/eAdventure/YoungBoy.xml</modelPath>
		</modelRef>
		<modelRef>
			<modelLabel>idModelLabel4</modelLabel>
			<iconPath>assets/Interface/Icons/eAdventure/young_girl.png</iconPath>
			<modelPath>assets/XML Configuration/models/eAdventure/YoungWoman.xml</modelPath>
		</modelRef>
	</modelsRef>
</family>
